{
  "schema_version": 1,
  "kind": "commit",
  "commit": "f5aca28aff6337e52f4ffde8d5348606d71c55ce",
  "commit_parent": "d7e540cb13099aa06cf4ca60fa6517cfd23197a9",
  "cas_digest": null,
  "change_id": null,
  "created_at": "2026-10-06T15:18:57Z",
  "generator": "scripts/generate-change-log.cjs",
  "generator_version": "1.0.0",
  "graph_schema_version": 2,
  "from_snapshot": {
    "basis": "commit",
    "rev": "d7e540cb13099aa06cf4ca60fa6517cfd23197a9",
    "tree": "a1e88cc5d67387afa3e67b5ce57096acd63d9434",
    "universe_hash": "91cf45b72e4086b06d56be988b212ee5ae6796163a097d06f75d8691c5b7b528",
    "tracked_total": 1489,
    "files": 1489,
    "edges": 498,
    "analysis_mode": "typescript"
  },
  "to_snapshot": {
    "basis": "commit",
    "rev": "f5aca28aff6337e52f4ffde8d5348606d71c55ce",
    "tree": "b402cb2e01df7673f8e278a4225f712f6fbcb35d",
    "universe_hash": "f7aa9cfadc6ea33627989063dba6e3bd78efce71380bb697ae84a1e9aecbb1bf",
    "tracked_total": 1490,
    "files": 1490,
    "edges": 498,
    "analysis_mode": "typescript"
  },
  "degradation": {
    "status": "complete",
    "reasons": [],
    "note": "两侧快照都完整重建：本次差在**文件层**是完整的（节点 = 全量已跟踪文件，边 = 扫描面产出的全部边）。数组为空 = 真的没有差异。"
  },
  "files": {
    "added": [
      "ledger/change-log/20261006T150812Z-d7e540c.json"
    ],
    "removed": [],
    "state_changed": []
  },
  "edges": {
    "added": [],
    "removed": [],
    "status_changed": []
  },
  "affected_referrers": [],
  "counts": {
    "files_added": 1,
    "files_removed": 0,
    "files_state_changed": 0,
    "edges_added": 0,
    "edges_removed": 0,
    "edges_status_changed": 0,
    "affected_referrers": 0,
    "needs_change": 0
  },
  "handling": {
    "status": "pending",
    "by": null,
    "at": null,
    "note": null
  },
  "summary": "提交 f5aca28（docs：DESIGN 全篇扫尽「复述活值」（第五批同族问题收口）+ 补 d7e540c 改动记录（含 HEAD 76/76 缺 0））：文件 +1/−0/±0 · 边 +0/−0/±0 · 受影响引用方 0 条（需改 0 条）",
  "omitted": [
    "declarations（符号级节点差，增量 3）",
    "type-reference 边（增量 3）",
    "传递闭包（affected_referrers 只到直接引用方，depth 恒 1；增量 5）",
    "查询接口（增量 5）",
    "cas-write 观测点（设计稿 §4.1 的第二个观测点，本批不实现）"
  ]
}
