{
  "schema_version": 1,
  "kind": "commit",
  "commit": "bc87618b97ca136419aa75116fb6a7bb991fd232",
  "commit_parent": "e56dcff17a59caab6caf28d6dd359a5230ba0fdf",
  "cas_digest": null,
  "change_id": null,
  "created_at": "2026-10-06T10:18:48Z",
  "generator": "scripts/generate-change-log.cjs",
  "generator_version": "1.0.0",
  "graph_schema_version": 2,
  "from_snapshot": {
    "basis": "commit",
    "rev": "e56dcff17a59caab6caf28d6dd359a5230ba0fdf",
    "tree": "c669fdaafd4b24c31c6ff990dc3b5a168d047ffe",
    "universe_hash": "8be4450160fbaa61b5830e0bd0c91de268d32191225f8a6e2b61ebb1a711e395",
    "tracked_total": 1474,
    "files": 1474,
    "edges": 498,
    "analysis_mode": "typescript"
  },
  "to_snapshot": {
    "basis": "commit",
    "rev": "bc87618b97ca136419aa75116fb6a7bb991fd232",
    "tree": "7dfc732b6a4b20cc4a5a811bc0c483cd93719083",
    "universe_hash": "8be4450160fbaa61b5830e0bd0c91de268d32191225f8a6e2b61ebb1a711e395",
    "tracked_total": 1474,
    "files": 1474,
    "edges": 498,
    "analysis_mode": "typescript"
  },
  "degradation": {
    "status": "complete",
    "reasons": [],
    "note": "两侧快照都完整重建：本次差在**文件层**是完整的（节点 = 全量已跟踪文件，边 = 扫描面产出的全部边）。数组为空 = 真的没有差异。"
  },
  "files": {
    "added": [],
    "removed": [],
    "state_changed": []
  },
  "edges": {
    "added": [],
    "removed": [],
    "status_changed": []
  },
  "affected_referrers": [],
  "counts": {
    "files_added": 0,
    "files_removed": 0,
    "files_state_changed": 0,
    "edges_added": 0,
    "edges_removed": 0,
    "edges_status_changed": 0,
    "affected_referrers": 0,
    "needs_change": 0
  },
  "handling": {
    "status": "pending",
    "by": null,
    "at": null,
    "note": null
  },
  "summary": "提交 bc87618（docs：三处「自述与实测不符」订正（meta.omitted #6-8 改「产物不含」口径 + 改动记录覆盖率口径 + emptyReading 死分支护栏注释））：文件 +0/−0/±0 · 边 +0/−0/±0 · 受影响引用方 0 条（需改 0 条）",
  "omitted": [
    "declarations（符号级节点差，增量 3）",
    "type-reference 边（增量 3）",
    "传递闭包（affected_referrers 只到直接引用方，depth 恒 1；增量 5）",
    "查询接口（增量 5）",
    "cas-write 观测点（设计稿 §4.1 的第二个观测点，本批不实现）"
  ]
}
