{
  "schema_version": 1,
  "kind": "commit",
  "commit": "7f7a97a85053b26477b6bf7290e47acf2bd56fd2",
  "commit_parent": "02302e6603987cd73e2a72eb822fbf42476a32d4",
  "cas_digest": null,
  "change_id": null,
  "created_at": "2026-10-06T14:30:22Z",
  "generator": "scripts/generate-change-log.cjs",
  "generator_version": "1.0.0",
  "graph_schema_version": 2,
  "from_snapshot": {
    "basis": "commit",
    "rev": "02302e6603987cd73e2a72eb822fbf42476a32d4",
    "tree": "ed1818ebc5c0f1cc33295ee2281e65ff750bde7f",
    "universe_hash": "a7cb06f81ac989201a6f8080da7295252b425421bce22f9b9ce4a9507d7534ec",
    "tracked_total": 1485,
    "files": 1485,
    "edges": 498,
    "analysis_mode": "typescript"
  },
  "to_snapshot": {
    "basis": "commit",
    "rev": "7f7a97a85053b26477b6bf7290e47acf2bd56fd2",
    "tree": "4c0c1355b1e1d8e3a32b4635ef80dd605287f0c9",
    "universe_hash": "74ba8e7f9766c707fd89d1904c1daae40dda982d7cd856a389f83b7cec0cfcff",
    "tracked_total": 1487,
    "files": 1487,
    "edges": 498,
    "analysis_mode": "typescript"
  },
  "degradation": {
    "status": "complete",
    "reasons": [],
    "note": "两侧快照都完整重建：本次差在**文件层**是完整的（节点 = 全量已跟踪文件，边 = 扫描面产出的全部边）。数组为空 = 真的没有差异。"
  },
  "files": {
    "added": [
      "ledger/change-log/20261006T141523Z-4643ed9.json",
      "ledger/change-log/20261006T141528Z-02302e6.json"
    ],
    "removed": [],
    "state_changed": []
  },
  "edges": {
    "added": [],
    "removed": [],
    "status_changed": []
  },
  "affected_referrers": [],
  "counts": {
    "files_added": 2,
    "files_removed": 0,
    "files_state_changed": 0,
    "edges_added": 0,
    "edges_removed": 0,
    "edges_status_changed": 0,
    "affected_referrers": 0,
    "needs_change": 0
  },
  "handling": {
    "status": "pending",
    "by": null,
    "at": null,
    "note": null
  },
  "summary": "提交 7f7a97a（ledger：补 4643ed9 与 02302e6 改动记录（含 HEAD 73/73 缺 0）—— 修掉第三次提交留下的滚动差 2）：文件 +2/−0/±0 · 边 +0/−0/±0 · 受影响引用方 0 条（需改 0 条）",
  "omitted": [
    "declarations（符号级节点差，增量 3）",
    "type-reference 边（增量 3）",
    "传递闭包（affected_referrers 只到直接引用方，depth 恒 1；增量 5）",
    "查询接口（增量 5）",
    "cas-write 观测点（设计稿 §4.1 的第二个观测点，本批不实现）"
  ]
}
