{
  "schema_version": 1,
  "kind": "commit",
  "commit": "a759461f794a7a9d5ec83699bbb07f5517775963",
  "commit_parent": "0e0a3561c7e6fc6aef8b5f0c8708ba009dd29654",
  "cas_digest": null,
  "change_id": null,
  "created_at": "2026-10-06T09:22:03Z",
  "generator": "scripts/generate-change-log.cjs",
  "generator_version": "1.0.0",
  "graph_schema_version": 2,
  "from_snapshot": {
    "basis": "commit",
    "rev": "0e0a3561c7e6fc6aef8b5f0c8708ba009dd29654",
    "tree": "aaed99d1d5ce8688429cd1371c6982bea8784d6c",
    "universe_hash": "fbd1b3143863ab4d848d62665b31a1ad6f4390858e3218bf9ef1b52912e5123a",
    "tracked_total": 1413,
    "files": 1413,
    "edges": 485,
    "analysis_mode": "typescript"
  },
  "to_snapshot": {
    "basis": "commit",
    "rev": "a759461f794a7a9d5ec83699bbb07f5517775963",
    "tree": "3e5037af95d91e5f35f03a549b17779af661b7d0",
    "universe_hash": "fbd1b3143863ab4d848d62665b31a1ad6f4390858e3218bf9ef1b52912e5123a",
    "tracked_total": 1413,
    "files": 1413,
    "edges": 486,
    "analysis_mode": "typescript"
  },
  "degradation": {
    "status": "complete",
    "reasons": [],
    "note": "两侧快照都完整重建：本次差在**文件层**是完整的（节点 = 全量已跟踪文件，边 = 扫描面产出的全部边）。数组为空 = 真的没有差异。"
  },
  "files": {
    "added": [],
    "removed": [],
    "state_changed": []
  },
  "edges": {
    "added": [
      "package.json:90:5:package-field:scripts[\"refs:query\"]→scripts/refs-query.cjs"
    ],
    "removed": [],
    "status_changed": []
  },
  "affected_referrers": [
    {
      "edge": "package.json:90:5:package-field:scripts[\"refs:query\"]→scripts/refs-query.cjs",
      "file": "package.json",
      "line": 90,
      "column": 5,
      "kind": "package-field",
      "target": "scripts/refs-query.cjs",
      "target_state": "indexed",
      "edge_status": "resolved",
      "classification": "edge-added",
      "needs_change": false
    }
  ],
  "counts": {
    "files_added": 0,
    "files_removed": 0,
    "files_state_changed": 0,
    "edges_added": 1,
    "edges_removed": 0,
    "edges_status_changed": 0,
    "affected_referrers": 1,
    "needs_change": 0
  },
  "handling": {
    "status": "pending",
    "by": null,
    "at": null,
    "note": null
  },
  "summary": "提交 a759461（refs-query 接线：新增 npm run refs:query 与 CONTRIBUTING 查询小节）：文件 +0/−0/±0 · 边 +1/−0/±0 · 受影响引用方 1 条（需改 0 条）",
  "omitted": [
    "declarations（符号级节点差，增量 3）",
    "type-reference 边（增量 3）",
    "传递闭包（affected_referrers 只到直接引用方，depth 恒 1；增量 5）",
    "查询接口（增量 5）",
    "cas-write 观测点（设计稿 §4.1 的第二个观测点，本批不实现）"
  ]
}
