{
  "schema_version": 1,
  "kind": "commit",
  "commit": "b6f22157a6ee8a66117d19c4cd21ff9c01a32b75",
  "commit_parent": "8ad10ecd4b198b727d9472648e931ee1291e4de9",
  "cas_digest": null,
  "change_id": null,
  "created_at": "2026-10-06T09:23:11Z",
  "generator": "scripts/generate-change-log.cjs",
  "generator_version": "1.0.0",
  "graph_schema_version": 2,
  "from_snapshot": {
    "basis": "commit",
    "rev": "8ad10ecd4b198b727d9472648e931ee1291e4de9",
    "tree": "68f33a2d259c74cd203ad31ea3afc23c68021b61",
    "universe_hash": "fbd1b3143863ab4d848d62665b31a1ad6f4390858e3218bf9ef1b52912e5123a",
    "tracked_total": 1413,
    "files": 1413,
    "edges": 486,
    "analysis_mode": "typescript"
  },
  "to_snapshot": {
    "basis": "commit",
    "rev": "b6f22157a6ee8a66117d19c4cd21ff9c01a32b75",
    "tree": "6642ee51bcbc51db79c9d0dc5ac451f667430362",
    "universe_hash": "fbd1b3143863ab4d848d62665b31a1ad6f4390858e3218bf9ef1b52912e5123a",
    "tracked_total": 1413,
    "files": 1413,
    "edges": 486,
    "analysis_mode": "typescript"
  },
  "degradation": {
    "status": "complete",
    "reasons": [],
    "note": "两侧快照都完整重建：本次差在**文件层**是完整的（节点 = 全量已跟踪文件，边 = 扫描面产出的全部边）。数组为空 = 真的没有差异。"
  },
  "files": {
    "added": [],
    "removed": [],
    "state_changed": []
  },
  "edges": {
    "added": [],
    "removed": [],
    "status_changed": []
  },
  "affected_referrers": [],
  "counts": {
    "files_added": 0,
    "files_removed": 0,
    "files_state_changed": 0,
    "edges_added": 0,
    "edges_removed": 0,
    "edges_status_changed": 0,
    "affected_referrers": 0,
    "needs_change": 0
  },
  "handling": {
    "status": "pending",
    "by": null,
    "at": null,
    "note": null
  },
  "summary": "提交 b6f2215（refs-query: impact 输出加入三档分类与 type_only 档内标注）：文件 +0/−0/±0 · 边 +0/−0/±0 · 受影响引用方 0 条（需改 0 条）",
  "omitted": [
    "declarations（符号级节点差，增量 3）",
    "type-reference 边（增量 3）",
    "传递闭包（affected_referrers 只到直接引用方，depth 恒 1；增量 5）",
    "查询接口（增量 5）",
    "cas-write 观测点（设计稿 §4.1 的第二个观测点，本批不实现）"
  ]
}
